{
  "$schema": "https://json-schema.org/draft/2020-12/schema",
  "additionalProperties": false,
  "properties": {
    "count": {
      "minimum": 1,
      "type": "integer"
    },
    "digest": {
      "pattern": "^[0-9a-f]{64}$",
      "type": "string"
    },
    "registry_id": {
      "const": "agon.mechanical_trial_stats_observability.registry.v0"
    },
    "runtime_posture": {
      "type": "string"
    },
    "stats_surfaces": {
      "items": {
        "$ref": "./agon_mechanical_trial_stats_observability.schema.json"
      },
      "minItems": 1,
      "type": "array"
    },
    "wave": {
      "const": "XIII"
    }
  },
  "required": [
    "registry_id",
    "wave",
    "runtime_posture",
    "count",
    "stats_surfaces",
    "digest"
  ],
  "type": "object"
}
