{"count":7,"digest":"5a6a4e1ebd349a5b768dc689deb2490204157df322b779353e256ba8f94e75ef","registry_id":"agon.mechanical_trial_stats_observability.registry.v0","runtime_posture":"candidate_only","stats_surfaces":[{"allowed_dimensions":["trial_run_count","candidate_terminal_outcome","stop_line_pressure","assistant_boundary_pressure","hash_chain_health"],"durable_scar_write":false,"forbidden_uses":["winner_declaration","rank_mutation","forced_routing","punishment","value_system"],"id":"agon.stats.trial_observability.broken_trace.candidate","live_protocol":false,"live_verdict_authority":false,"rank_mutation":false,"retention_execution":false,"runtime_effect":"none","source_surfaces":["abyss-stack/generated/agon_mechanical_trial_run_registry.min.json","aoa-evals/generated/agon_mechanical_trial_eval_suite_registry.min.json"],"summary_candidates":["agon.stats.vds.scar_request_pressure_summary","agon.stats.vds.verdict_outcome_draft_summary"],"tos_promotion":false,"trial_id":"agon.trial.mechanical.broken_trace.v0"},{"allowed_dimensions":["trial_run_count","candidate_terminal_outcome","stop_line_pressure","assistant_boundary_pressure","hash_chain_health"],"durable_scar_write":false,"forbidden_uses":["winner_declaration","rank_mutation","forced_routing","punishment","value_system"],"id":"agon.stats.trial_observability.fallback_honor.candidate","live_protocol":false,"live_verdict_authority":false,"rank_mutation":false,"retention_execution":false,"runtime_effect":"none","source_surfaces":["abyss-stack/generated/agon_mechanical_trial_run_registry.min.json","aoa-evals/generated/agon_mechanical_trial_eval_suite_registry.min.json"],"summary_candidates":["agon.stats.vds.delta_depth_candidate_summary","agon.stats.vds.verdict_outcome_draft_summary"],"tos_promotion":false,"trial_id":"agon.trial.mechanical.fallback_honor.v0"},{"allowed_dimensions":["trial_run_count","candidate_terminal_outcome","stop_line_pressure","assistant_boundary_pressure","hash_chain_health"],"durable_scar_write":false,"forbidden_uses":["winner_declaration","rank_mutation","forced_routing","punishment","value_system"],"id":"agon.stats.trial_observability.contradiction_endurance.candidate","live_protocol":false,"live_verdict_authority":false,"rank_mutation":false,"retention_execution":false,"runtime_effect":"none","source_surfaces":["abyss-stack/generated/agon_mechanical_trial_run_registry.min.json","aoa-evals/generated/agon_mechanical_trial_eval_suite_registry.min.json"],"summary_candidates":["agon.stats.contradiction_integrity_summary","agon.stats.vds.retention_pressure_summary"],"tos_promotion":false,"trial_id":"agon.trial.mechanical.contradiction_endurance.v0"},{"allowed_dimensions":["trial_run_count","candidate_terminal_outcome","stop_line_pressure","assistant_boundary_pressure","hash_chain_health"],"durable_scar_write":false,"forbidden_uses":["winner_declaration","rank_mutation","forced_routing","punishment","value_system"],"id":"agon.stats.trial_observability.costly_closure.candidate","live_protocol":false,"live_verdict_authority":false,"rank_mutation":false,"retention_execution":false,"runtime_effect":"none","source_surfaces":["abyss-stack/generated/agon_mechanical_trial_run_registry.min.json","aoa-evals/generated/agon_mechanical_trial_eval_suite_registry.min.json"],"summary_candidates":["agon.stats.closure_discipline_summary","agon.stats.vds.scar_request_pressure_summary"],"tos_promotion":false,"trial_id":"agon.trial.mechanical.costly_closure.v0"},{"allowed_dimensions":["trial_run_count","candidate_terminal_outcome","stop_line_pressure","assistant_boundary_pressure","hash_chain_health"],"durable_scar_write":false,"forbidden_uses":["winner_declaration","rank_mutation","forced_routing","punishment","value_system"],"id":"agon.stats.trial_observability.assistant_escalation.candidate","live_protocol":false,"live_verdict_authority":false,"rank_mutation":false,"retention_execution":false,"runtime_effect":"none","source_surfaces":["abyss-stack/generated/agon_mechanical_trial_run_registry.min.json","aoa-evals/generated/agon_mechanical_trial_eval_suite_registry.min.json"],"summary_candidates":["agon.stats.assistant_escalation_summary","agon.stats.vds.verdict_outcome_draft_summary"],"tos_promotion":false,"trial_id":"agon.trial.mechanical.assistant_escalation.v0"},{"allowed_dimensions":["trial_run_count","candidate_terminal_outcome","stop_line_pressure","assistant_boundary_pressure","hash_chain_health"],"durable_scar_write":false,"forbidden_uses":["winner_declaration","rank_mutation","forced_routing","punishment","value_system"],"id":"agon.stats.trial_observability.prediction.candidate","live_protocol":false,"live_verdict_authority":false,"rank_mutation":false,"retention_execution":false,"runtime_effect":"none","source_surfaces":["abyss-stack/generated/agon_mechanical_trial_run_registry.min.json","aoa-evals/generated/agon_mechanical_trial_eval_suite_registry.min.json"],"summary_candidates":["agon.stats.vds.delta_depth_candidate_summary","agon.stats.recurrence_review_pressure_summary"],"tos_promotion":false,"trial_id":"agon.trial.mechanical.prediction.v0"},{"allowed_dimensions":["trial_run_count","candidate_terminal_outcome","stop_line_pressure","assistant_boundary_pressure","hash_chain_health"],"durable_scar_write":false,"forbidden_uses":["winner_declaration","rank_mutation","forced_routing","punishment","value_system"],"id":"agon.stats.trial_observability.expensive_summon_intent.candidate","live_protocol":false,"live_verdict_authority":false,"rank_mutation":false,"retention_execution":false,"runtime_effect":"none","source_surfaces":["abyss-stack/generated/agon_mechanical_trial_run_registry.min.json","aoa-evals/generated/agon_mechanical_trial_eval_suite_registry.min.json"],"summary_candidates":["agon.stats.summon_pressure_summary","agon.stats.vds.retention_pressure_summary"],"tos_promotion":false,"trial_id":"agon.trial.mechanical.expensive_summon_intent.v0"}],"wave":"XIII"}
